{
  "name": "pr-review-canvas",
  "description": "Render PR diffs as interactive Cursor Canvases organized for reviewer comprehension — groups changes by importance, separates boilerplate from core logic, and highlights tricky or unexpected code.",
  "version": "0.1.0",
  "author": {
    "name": "Cursor",
    "email": "plugins@cursor.com"
  },
  "homepage": "https://github.com/cursor/plugins/tree/main/pr-review-canvas",
  "repository": "https://github.com/cursor/plugins",
  "license": "MIT"
}
