{
  "name": "google-calendar",
  "description": "Connect Cursor to Google Calendar via Google's remote MCP server — list calendars, search events, and create or update meetings.",
  "version": "1.0.0",
  "author": {
    "name": "Cursor",
    "email": "plugins@cursor.com"
  },
  "homepage": "https://github.com/cursor/plugins/tree/main/google-calendar",
  "repository": "https://github.com/cursor/plugins",
  "license": "MIT",
  "keywords": [
    "google-calendar",
    "calendar",
    "google",
    "mcp",
    "events",
    "workspace"
  ]
}
