{
  "name": "cli-for-agent",
  "description": "Patterns for designing CLIs that coding agents can run reliably: non-interactive flags, layered help with examples, pipelines, actionable errors, idempotency, and dry-run.",
  "version": "1.0.0",
  "author": {
    "name": "Cursor",
    "email": "plugins@cursor.com"
  },
  "homepage": "https://github.com/cursor/plugins/tree/main/cli-for-agent",
  "repository": "https://github.com/cursor/plugins",
  "license": "MIT",
  "skills": "./skills/",
  "keywords": [
    "cli",
    "command-line",
    "agents",
    "automation",
    "terminal",
    "flags",
    "help"
  ]
}
