{
  "name": "agent-compatibility",
  "description": "CLI-backed repo compatibility scans plus Cursor agents that audit startup, validation, and docs against reality.",
  "version": "1.0.0",
  "author": {
    "name": "Cursor",
    "email": "plugins@cursor.com"
  },
  "homepage": "https://github.com/cursor/plugins/tree/main/agent-compatibility",
  "repository": "https://github.com/cursor/plugins",
  "license": "MIT",
  "skills": "./skills/",
  "agents": [
    "./agents/compatibility-scan-review.md",
    "./agents/docs-reliability-review.md",
    "./agents/startup-review.md",
    "./agents/validation-review.md"
  ],
  "keywords": [
    "agent-compatibility",
    "agents",
    "compatibility",
    "cursor-plugin",
    "repo-audit",
    "startup",
    "validation"
  ]
}
