{
  "name": "gmail",
  "description": "Connect Cursor to Gmail via Google's remote MCP server — search, read, draft, label, and manage email.",
  "version": "1.0.0",
  "author": {
    "name": "Cursor",
    "email": "plugins@cursor.com"
  },
  "homepage": "https://github.com/cursor/plugins/tree/main/gmail",
  "repository": "https://github.com/cursor/plugins",
  "license": "MIT"
}
