{
  "name": "google-docs",
  "description": "Connect Cursor to Google Docs via Google's remote MCP server — read and update documents.",
  "version": "1.0.0",
  "author": {
    "name": "Cursor",
    "email": "plugins@cursor.com"
  },
  "homepage": "https://github.com/cursor/plugins/tree/main/google-docs",
  "repository": "https://github.com/cursor/plugins",
  "license": "MIT"
}
