{
  "name": "create-plugin",
  "description": "Scaffold and validate new Cursor plugins. Handles directory setup, manifest generation, and pre-submission quality checks for the marketplace.",
  "version": "1.0.0",
  "author": {
    "name": "Cursor",
    "email": "plugins@cursor.com"
  },
  "homepage": "https://github.com/cursor/plugins",
  "repository": "https://github.com/cursor/plugins",
  "license": "MIT",
  "skills": "./skills/",
  "agents": [
    "./agents/plugin-architect.md"
  ],
  "keywords": [
    "create-plugin",
    "cursor-plugin",
    "marketplace",
    "plugin-authoring"
  ]
}
