{
  "name": "cursor-sdk",
  "description": "Build apps, scripts, CI pipelines, and automations on top of the Cursor TypeScript SDK (@cursor/sdk) — runtime selection, auth, streaming, MCP, error handling, and ready-to-extend integration patterns.",
  "version": "1.0.0",
  "author": {
    "name": "Cursor",
    "email": "plugins@cursor.com"
  },
  "homepage": "https://github.com/cursor/plugins/tree/main/cursor-sdk",
  "repository": "https://github.com/cursor/plugins",
  "license": "MIT"
}
