{
  "name": "google-slides",
  "description": "Connect Cursor to Google Slides via Google's remote MCP server — read and update presentations.",
  "version": "1.0.0",
  "author": {
    "name": "Cursor",
    "email": "plugins@cursor.com"
  },
  "homepage": "https://github.com/cursor/plugins/tree/main/google-slides",
  "repository": "https://github.com/cursor/plugins",
  "license": "MIT",
  "keywords": [
    "google-slides",
    "slides",
    "presentations",
    "google",
    "mcp",
    "workspace"
  ]
}
