{
  "name": "ralph-loop",
  "displayName": "Ralph Loop",
  "version": "1.0.1",
  "description": "Continuous self-referential AI loops for iterative development, implementing the Ralph Wiggum technique. Run the agent in a while-true loop with the same prompt until task completion.",
  "author": {
    "name": "Cursor",
    "email": "plugins@cursor.com"
  },
  "homepage": "https://github.com/cursor/plugins",
  "repository": "https://github.com/cursor/plugins",
  "license": "MIT",
  "logo": "assets/avatar.png",
  "keywords": [
    "ralph",
    "loop",
    "iteration",
    "self-referential",
    "automation",
    "iterative-development"
  ],
  "category": "developer-tools",
  "tags": [
    "automation",
    "iteration",
    "agent-loop"
  ],
  "skills": "./skills/",
  "hooks": "./hooks/cursor-hooks.json"
}
