{
  "name": "google-drive",
  "description": "Connect Cursor to Google Drive via Google's remote MCP server — search, read, create, share, and manage files.",
  "version": "1.0.0",
  "author": {
    "name": "Cursor",
    "email": "plugins@cursor.com"
  },
  "homepage": "https://github.com/cursor/plugins/tree/main/google-drive",
  "repository": "https://github.com/cursor/plugins",
  "license": "MIT"
}
