{
  "name": "docs-canvas",
  "description": "Render documentation — architecture notes, API references, runbooks, and codebase walkthroughs — as a navigable Cursor Canvas with sections, table of contents, diagrams, and cross-references.",
  "version": "0.1.0",
  "author": {
    "name": "Cursor",
    "email": "plugins@cursor.com"
  },
  "homepage": "https://github.com/cursor/plugins/tree/main/docs-canvas",
  "repository": "https://github.com/cursor/plugins",
  "license": "MIT",
  "skills": "./skills/",
  "keywords": [
    "cursor-plugin",
    "canvas",
    "documentation",
    "docs",
    "architecture",
    "reference"
  ]
}
