{
  "name": "pstack",
  "description": "if you want to go fast, go deep first. pstack helps you write less, but higher quality code. rigorous agent workflows you can parallelize with confidence.",
  "version": "0.12.0",
  "author": {
    "name": "Lauren Tan"
  },
  "homepage": "https://github.com/cursor/plugins/tree/main/pstack",
  "repository": "https://github.com/cursor/plugins",
  "license": "MIT",
  "droids": "./droids"
}
