{
  "name": "thermos",
  "description": "Thermo-nuclear branch review: deep correctness and security audits plus harsh code-quality rubrics, parallel subagents, thermos orchestration, and optional take-the-wheel and FSD merge-ready flows.",
  "version": "1.0.0",
  "author": {
    "name": "Cursor",
    "email": "plugins@cursor.com"
  },
  "homepage": "https://github.com/cursor/plugins",
  "repository": "https://github.com/cursor/plugins",
  "license": "MIT",
  "droids": "./droids"
}
