{
  "name": "google-sheets",
  "description": "Connect Cursor to Google Sheets via Google's remote MCP server — read spreadsheets, update values and formulas.",
  "version": "1.0.0",
  "author": {
    "name": "Cursor",
    "email": "plugins@cursor.com"
  },
  "homepage": "https://github.com/cursor/plugins/tree/main/google-sheets",
  "repository": "https://github.com/cursor/plugins",
  "license": "MIT"
}
