{
  "name": "teaching",
  "description": "Skill mapping, practice plans, and learning retrospectives. Builds personalized roadmaps with milestones and practice checkpoints, and runs periodic reviews to adjust based on progress.",
  "version": "1.0.0",
  "author": {
    "name": "Cursor",
    "email": "plugins@cursor.com"
  },
  "homepage": "https://github.com/cursor/plugins",
  "repository": "https://github.com/cursor/plugins",
  "license": "MIT",
  "skills": "./skills/",
  "keywords": [
    "teaching",
    "study-plan",
    "practice",
    "feedback",
    "mentorship"
  ]
}
