{
  "name": "cursor-team-kit",
  "description": "Internal workflows used by Cursor developers for CI, code review, shipping, control-cli, control-ui, verify-this, test reliability, code cleanup, and work summaries. Designed to work without requiring third-party service integrations.",
  "version": "1.2.0",
  "author": {
    "name": "Cursor",
    "email": "plugins@cursor.com"
  },
  "homepage": "https://github.com/cursor/plugins",
  "repository": "https://github.com/cursor/plugins",
  "license": "MIT",
  "skills": "./skills/",
  "agents": [
    "./agents/ci-watcher.md",
    "./agents/thermo-nuclear-code-quality-review.md"
  ],
  "keywords": [
    "cursor-team-kit",
    "ci",
    "code-review",
    "shipping",
    "testing",
    "verification",
    "local-automation"
  ]
}
