{
  "name": "continual-learning",
  "description": "Incrementally learns durable user preferences and workspace facts from transcript changes and keeps AGENTS.md up to date with plain bullet points.",
  "version": "1.0.0",
  "author": {
    "name": "Cursor",
    "email": "plugins@cursor.com"
  },
  "homepage": "https://github.com/cursor/plugins",
  "repository": "https://github.com/cursor/plugins",
  "license": "MIT",
  "skills": "./skills/",
  "agents": [
    "./agents/agents-memory-updater.md"
  ],
  "keywords": [
    "continual-learning",
    "agent-memory",
    "transcripts",
    "hooks",
    "incremental"
  ]
}
