{
  "name": "orchestrate",
  "description": "Fan a large task out across parallel Cursor cloud agents via the Cursor SDK: planners publish tasks, workers hand off back up, and a script reconciles the tree from disk and git.",
  "version": "1.1.0",
  "author": {
    "name": "Cursor",
    "email": "plugins@cursor.com"
  },
  "homepage": "https://github.com/cursor/plugins/tree/main/orchestrate",
  "repository": "https://github.com/cursor/plugins",
  "license": "MIT",
  "skills": "./skills/",
  "keywords": [
    "orchestrate",
    "cursor",
    "cursor-sdk",
    "agents",
    "cloud-agents",
    "parallel",
    "automation"
  ]
}
