{
  "name": "agent-compatibility",
  "description": "CLI-backed repo compatibility scans plus Cursor agents that audit startup, validation, and docs against reality.",
  "version": "1.0.0",
  "author": {
    "name": "Cursor",
    "email": "plugins@cursor.com"
  },
  "homepage": "https://github.com/cursor/plugins/tree/main/agent-compatibility",
  "repository": "https://github.com/cursor/plugins",
  "license": "MIT",
  "droids": "./droids"
}
