{
  "name": "ralph-loop",
  "description": "Continuous self-referential AI loops for iterative development, implementing the Ralph Wiggum technique. Run the agent in a while-true loop with the same prompt until task completion.",
  "version": "1.0.0",
  "author": {
    "name": "Cursor",
    "email": "plugins@cursor.com"
  },
  "homepage": "https://github.com/cursor/plugins",
  "repository": "https://github.com/cursor/plugins",
  "license": "MIT",
  "skills": "./skills/",
  "keywords": [
    "ralph",
    "loop",
    "iteration",
    "self-referential",
    "automation",
    "iterative-development"
  ]
}
