{
  "name": "thermos",
  "description": "Thermo-nuclear branch review: deep correctness and security audits plus harsh code-quality rubrics, parallel subagents, thermos orchestration, and optional take-the-wheel and FSD merge-ready flows.",
  "version": "1.0.0",
  "author": {
    "name": "Cursor",
    "email": "plugins@cursor.com"
  },
  "homepage": "https://github.com/cursor/plugins",
  "repository": "https://github.com/cursor/plugins",
  "license": "MIT",
  "skills": "./skills/",
  "agents": [
    "./agents/thermo-nuclear-code-quality-review-subagent.md",
    "./agents/thermo-nuclear-review-subagent.md"
  ],
  "keywords": [
    "thermos",
    "thermo-nuclear",
    "code-review",
    "deep-review",
    "code-quality",
    "security-review",
    "subagents"
  ]
}
